{
  "schemaVersion": "agentdoor.task-plan.v0.2",
  "requestId": "req-real-b-log-01",
  "baseSnapshotId": "snapshot-real-b-log-01-v5",
  "baseRevision": 5,
  "baseTaskVersions": {
    "b-log-root": 15,
    "b-log-data": 6,
    "b-log-infra": 7,
    "b-log-ops": 8,
    "b-log-map-pack": 5,
    "b-log-label-map": 5,
    "b-log-access-pack": 4,
    "b-log-carrier-account": 6,
    "b-log-customs-access": 3,
    "b-log-runbook-pack": 6,
    "b-log-runbook": 6,
    "b-log-dryrun": 8,
    "b-log-carrier-test": 4
  },
  "intent": "replan",
  "disposition": "needs_clarification",
  "summary": "暂不生成东沄华东仓全树差异；需先续读剩余14项任务及未加载讨论和历史，再完整识别映射v4消费者、跨分支依赖与9月19日窗口。",
  "reasoningSummary": [
    {
      "text": "当前只读取27项中的13项，剩余两个任务分页明确包含其他映射消费者。",
      "evidenceRefs": ["b-log-page-receipt", "req-real-b-log-01"]
    },
    {
      "text": "夜班作业、异常客服和关务切换主题的讨论及相关历史尚未读取，无法判断完整依赖和边界。",
      "evidenceRefs": ["b-log-discussion-receipt", "b-log-d2"]
    },
    {
      "text": "映射v4已知影响标签联测和切换手册，但文件也明确说明完整消费者仍在后续分页。",
      "evidenceRefs": ["b-log-map-v4", "b-log-d1"]
    },
    {
      "text": "承运商账号和回退演练已有完成记录，应保留并在完整读取后复用。",
      "evidenceRefs": ["b-log-h1", "b-log-h2", "b-log-d4"]
    }
  ],
  "proposal": null,
  "duplicateCheck": {
    "status": "partial",
    "scopeTeamIds": ["team-b-log"],
    "assessments": [
      {
        "taskId": "b-log-label-map",
        "relationship": "same_outcome",
        "reason": "当前页已见同一东沄映射v4确认任务，但查重范围尚未覆盖完整任务树。",
        "evidenceRefs": ["b-log-label-map", "b-log-map-v4"]
      },
      {
        "taskId": "b-log-runbook",
        "relationship": "same_outcome",
        "reason": "当前页已见同一切换手册消费者，其他消费者仍待分页读取。",
        "evidenceRefs": ["b-log-runbook", "b-log-page-receipt"]
      }
    ],
    "coverageNote": "仅检索当前13项及本页相关归档；后续任务页和未读讨论未覆盖，不能排除其他同结果或消费者。"
  },
  "questions": [],
  "warnings": [
    "任务、子任务、讨论、历史和查重均为部分覆盖，当前不能声称全树已就绪，也不能猜测隐藏消费者。",
    "关务SFTP仅有9月16日预计回执且凭据正文未授权，不能视为已开通。",
    "9月19日切换窗口保持硬边界；完整读取后仍需复核所有前置日期。"
  ],
  "nextActions": [
    {"action": "retry_context", "taskId": "b-log-root", "label": "续读b-log-page-2、b-log-page-3和b-log-thread-page-2后重新规划"}
  ],
  "externalEffects": "none"
}
